{
  "schemaVersion": "1.0.0",
  "stageId": "fixture-terraform-stage-valid",
  "generatedAt": "2026-08-24T20:00:00Z",
  "scope": {
    "repositories": [
      "microservice-app-gitops"
    ],
    "destinations": [],
    "stateKeys": [
      "microtodosuite/full-dev/foundation"
    ],
    "capabilities": [
      "evidence-validation"
    ]
  },
  "identities": {
    "gitActor": "fixture",
    "awsAccountId": "916491575487"
  },
  "baseline": {
    "result": "pass",
    "evidence": [
      "tests/evidence/fixtures/artifacts/pass.txt"
    ]
  },
  "artifacts": [
    {
      "kind": "identity",
      "path": "tests/evidence/fixtures/artifacts/pass.txt",
      "sha256": "c26de83abdc9496cd1301470918ec39ecca1cf389ef0ae1c6504da1800d1c431",
      "producer": "fixture",
      "result": "pass"
    },
    {
      "kind": "identity",
      "path": "tests/evidence/fixtures/artifacts/identity.txt",
      "sha256": "0911183909f0d5fda956691e65fb25e3357d5325808f81dd5220b454b3b983f3",
      "producer": "fixture",
      "result": "pass"
    },
    {
      "kind": "terraform-plan",
      "path": "tests/evidence/fixtures/artifacts/terraform-plan.txt",
      "sha256": "fb0a7f6e5a51601547b3270d91122a3659c6a4dd1475a9bfb747f66ad371f8c1",
      "producer": "fixture",
      "result": "pass"
    },
    {
      "kind": "infracost",
      "path": "tests/evidence/fixtures/artifacts/infracost.json",
      "sha256": "15ff19456e08d7d4c3bdc1f5e743ca17cad842d49b29ca1d93c18ee95117ccfd",
      "producer": "fixture",
      "result": "pass"
    },
    {
      "kind": "state-backup",
      "path": "tests/evidence/fixtures/artifacts/state-backup.txt",
      "sha256": "fc1d9b6af59a149149fcbff8852569fd032366cf8e87de66da0d4d27a3eb8282",
      "producer": "fixture",
      "result": "pass"
    },
    {
      "kind": "approval",
      "path": "tests/evidence/fixtures/artifacts/approval.txt",
      "sha256": "82c8f8af98b335ba9df3b77d297742d4fbf789e4b0632315dd21be7e02a5d9a3",
      "producer": "fixture",
      "result": "pass",
      "approvedBy": "fixture-reviewer"
    }
  ],
  "requirements": {
    "FR-001": {
      "result": "pass",
      "evidence": [
        "tests/evidence/fixtures/artifacts/pass.txt"
      ]
    }
  },
  "rollback": {
    "result": "pass",
    "evidence": [
      "tests/evidence/fixtures/artifacts/pass.txt"
    ]
  },
  "postBaseline": {
    "result": "pass",
    "evidence": [
      "tests/evidence/fixtures/artifacts/pass.txt"
    ]
  },
  "decision": "accepted"
}